{
    "$schema": "../../schemas/plugin-manifest.schema.json",
    "id": "adversea",
    "version": "0.1.0",
    "name": "Adversea",
    "description": "Screens individuals and organizations against PEP lists, sanctions, social media, and topic-based adverse media via the Adversea API.",
    "authors": [
        {
            "name": "OpenRiskPlatform",
            "email": "example@openrisk.platform"
        }
    ],
    "icon": "icon.png",
    "license": "MIT",
    "main": "index.ts",
    "entrypoints": [
        {
            "id": "pep-sanctions",
            "name": "PEP & Sanctions Check",
            "description": "Checks PEP exposure and active sanctions datasets for the target name.",
            "function": "pepSanctionsCheck",
            "inputs": [
                {
                    "name": "target",
                    "type": "string",
                    "optional": false,
                    "title": "Target Name",
                    "description": "Full name of the person or organization to screen."
                }
            ]
        },
        {
            "id": "topic-report",
            "name": "Topic Report",
            "description": "Adverse media analysis grouped by risk topics (corruption, financial crime, etc.).",
            "function": "topicReport",
            "inputs": [
                {
                    "name": "target",
                    "type": "string",
                    "optional": false,
                    "title": "Target Name",
                    "description": "Full name of the person or organization to screen."
                },
                {
                    "name": "output_language",
                    "type": {
                        "name": "enum",
                        "values": [
                            "English",
                            "Slovak"
                        ]
                    },
                    "optional": true,
                    "title": "Output Language",
                    "description": "Language for the generated text output.",
                    "default": "English"
                }
            ]
        },
        {
            "id": "social-media",
            "name": "Social Media",
            "description": "Finds public social media profiles matching the target name.",
            "function": "socialMediaCheck",
            "inputs": [
                {
                    "name": "target",
                    "type": "string",
                    "optional": false,
                    "title": "Target Name",
                    "description": "Full name of the person or organization to screen."
                }
            ]
        }
    ],
    "settings": [
        {
            "name": "api_key",
            "type": "string",
            "title": "Adversea API Key",
            "description": "Your Adversea API key (X-Adversea-Api-Key header).",
            "required": true,
            "default": null
        }
    ]
}